{
  "version": 1,
  "id": "orleans-ep04",
  "mode": "story",
  "density": "scene-rich",
  "goal": "Faire sentir le passage de Jeanne d'une mission improbable à une arrivée concrète dans Orléans, sans répéter la grande fiction dialoguée Jeanne-vers-le-roi.",
  "historical_mode": "documented",
  "constraints": ["no_narration_duplicates_obvious_sound","one_primary_attention_owner_per_beat","continuous_layers_need_narrative_reason","silence_is_allowed","measured_voice_timing_is_authoritative"],
  "beats": [
    {"id":"different-mental-world","attention_owner":"voice","purpose":"installer le cadre religieux et politique sans effet mystique"},
    {"id":"filters-before-belief","attention_owner":"voice","purpose":"faire entendre que Jeanne passe par des vérifications humaines et institutionnelles"},
    {"id":"journey-to-orleans","after_segment":7,"attention_owner":"sound","purpose":"transformer le convoi et la route en mouvement juste avant l'entrée du 29 avril","sound":"historic-horse-hooves","handoff":"narration-to-foreground-travel-to-arrival","exit":"carry-under-arrival-then-fade","rationale":"le son matérialise enfin le déplacement après plusieurs paragraphes consacrés aux filtres et à la préparation"},
    {"id":"arrival-weight","attention_owner":"silence","purpose":"laisser une respiration après l'entrée dans Orléans avant d'expliquer les rapports avec les capitaines","exit":"held-pause"},
    {"id":"no-magic-no-mascot","attention_owner":"voice","purpose":"conclure sur la nuance historique plutôt que sur un climax musical"}
  ]
}
